ID;Nombre;Descripción;Posición;Mostrados;;;;;;;;;;;;;;;;;;;;;
1;Hombre;Aqui encontraras todos los productos de joyeria para hombres;0;1;;;;;;;;;;;;;;;;;;;;;
2;Mujer;Aqui encontraras todos los productos de joyeria para mujeres;1;1;;;;;;;;;;;;;;;;;;;;;
3;Plata;Productos de Plata;2;1;;;;;;;;;;;;;;;;;;;;;
4;Acero inoxidable;Productos de Acero inoxidable;3;1;;;;;;;;;;;;;;;;;;;;;
5;Bisuteria;Productos de Bisuteria;4;1;;;;;;;;;;;;;;;;;;;;;
6;Joyeria Italiana;Linea Italiana de joyeria;5;1;;;;;;;;;;;;;;;;;;;;;